{
  "$schema": "https://schemas.8lines.dev/gauntlet/fixtures/v1/adapter-semantic-vectors.schema.json",
  "format": "tc-adapter-semantic-vectors@1",
  "patchProfile": "rfc6902-test-subset@1",
  "presetAssemblyProfile": "tc-preset-operation@1",
  "workloadProfile": "tc-preset-workloads@1",
  "sourceFixtures": [
    {
      "id": "manifest",
      "file": "manifest.valid.json",
      "sha256": "sha256:1bca35d1dcd17847fd5e97a74e6803adbc7dad62a5ea2681f65ffcaca56d0fb5",
      "revisionField": "manifestRevision"
    },
    {
      "id": "operation",
      "file": "operation.valid.json",
      "sha256": "sha256:8e0d52a085c4d5b2392ae03269a74f267806914648f735d34be89e20046e8cf0",
      "revisionField": "revision"
    },
    {
      "id": "resolve-request",
      "file": "data-source-resolve-request.valid.json",
      "sha256": "sha256:fb7afb06128bfc2e6edaa827e32dc6fa48484f624010ff5d40c16d8d0a7a5856"
    },
    {
      "id": "resolve-response",
      "file": "data-source-resolve-response.valid.json",
      "sha256": "sha256:37c5ef68864df86e3083d395bb9fe6d506c9ec436f4aca146016668bbb2b03fb"
    }
  ],
  "presetAnalysisLimits": {
    "maxGraphNodes": 250000,
    "maxGraphEdges": 500000,
    "maxPresetVisits": 500000,
    "minimumVisitBudget": 8192,
    "graphNodeWeight": 4,
    "graphEdgeWeight": 2,
    "inputNodeWeight": 64,
    "routeCountSaturation": 2
  },
  "documentVectors": [
    {
      "id": "manifest.valid",
      "predicate": "manifest",
      "precondition": "envelope-valid",
      "document": {
        "source": "manifest",
        "patches": [],
        "revision": {
          "mode": "preserve",
          "expect": "match"
        }
      },
      "expected": true
    },
    {
      "id": "manifest.stale-revision",
      "predicate": "manifest",
      "precondition": "envelope-valid",
      "document": {
        "source": "manifest",
        "patches": [
          {
            "op": "replace",
            "path": "/application/label",
            "value": "Changed without a new revision"
          }
        ],
        "revision": {
          "mode": "preserve",
          "expect": "mismatch"
        }
      },
      "expected": false
    },
    {
      "id": "manifest.environment.production-name",
      "predicate": "manifest",
      "precondition": "envelope-valid",
      "document": {
        "source": "manifest",
        "patches": [
          {
            "op": "replace",
            "path": "/application/environment/name",
            "value": "acme-prod-eu"
          }
        ],
        "revision": {
          "mode": "set",
          "value": "sha256:0a7c63eb0f7401834b349fb9063087e372b681e1c5f735baa3d2c731e960a575",
          "expect": "match"
        }
      },
      "expected": false
    },
    {
      "id": "manifest.feature.duplicate-id",
      "predicate": "manifest",
      "precondition": "envelope-valid",
      "document": {
        "source": "manifest",
        "patches": [
          {
            "op": "copy",
            "from": "/features/0",
            "path": "/features/-"
          }
        ],
        "revision": {
          "mode": "set",
          "value": "sha256:95ffd2eea592347adb49a319e52d00385a681bd63e7144905debb60e06dcec80",
          "expect": "match"
        }
      },
      "expected": false
    },
    {
      "id": "manifest.feature.missing-parent",
      "predicate": "manifest",
      "precondition": "envelope-valid",
      "document": {
        "source": "manifest",
        "patches": [
          {
            "op": "add",
            "path": "/features/-",
            "value": {
              "id": "missing-parent-child",
              "label": "Missing parent child",
              "parentId": "missing-parent"
            }
          }
        ],
        "revision": {
          "mode": "set",
          "value": "sha256:552d9c85d660d38ca8562aaa6cc178b92bb800d779a739a3e0eeaf6845b8af5d",
          "expect": "match"
        }
      },
      "expected": false
    },
    {
      "id": "manifest.feature.cycle",
      "predicate": "manifest",
      "precondition": "envelope-valid",
      "document": {
        "source": "manifest",
        "patches": [
          {
            "op": "add",
            "path": "/features/-",
            "value": {
              "id": "cycle-a",
              "label": "Cycle A",
              "parentId": "cycle-b"
            }
          },
          {
            "op": "add",
            "path": "/features/-",
            "value": {
              "id": "cycle-b",
              "label": "Cycle B",
              "parentId": "cycle-a"
            }
          }
        ],
        "revision": {
          "mode": "set",
          "value": "sha256:7fd8a0523415c8c019a686a929703b6949f911f8c60dbde887947b351e410786",
          "expect": "match"
        }
      },
      "expected": false
    },
    {
      "id": "manifest.operation.duplicate-id",
      "predicate": "manifest",
      "precondition": "envelope-valid",
      "document": {
        "source": "manifest",
        "patches": [
          {
            "op": "copy",
            "from": "/operations/0",
            "path": "/operations/-"
          }
        ],
        "revision": {
          "mode": "set",
          "value": "sha256:7f2e81f3416b4c6002fa782c19b0cf7d42ac6a61e7c6402117714a4adfe79f4b",
          "expect": "match"
        }
      },
      "expected": false
    },
    {
      "id": "manifest.data-source.duplicate-id",
      "predicate": "manifest",
      "precondition": "envelope-valid",
      "document": {
        "source": "manifest",
        "patches": [
          {
            "op": "copy",
            "from": "/dataSources/0",
            "path": "/dataSources/-"
          }
        ],
        "revision": {
          "mode": "set",
          "value": "sha256:18e60b2391a0386010876a9e3ae52886d7beaacb9751a33872db48d19ffdc6b2",
          "expect": "match"
        }
      },
      "expected": false
    },
    {
      "id": "manifest.unavailable.missing-profile",
      "predicate": "manifest",
      "precondition": "envelope-valid",
      "document": {
        "source": "manifest",
        "patches": [
          {
            "op": "remove",
            "path": "/profiles/2"
          },
          {
            "op": "replace",
            "path": "/operations/0/availability",
            "value": {
              "state": "unavailable",
              "problem": {
                "type": "urn:gauntlet:problem:unsupported-capability",
                "title": "Operation requirements are unavailable",
                "status": 501
              }
            }
          }
        ],
        "revision": {
          "mode": "set",
          "value": "sha256:c99b6e365c6753251aad93461dfb55b2b0620c20eee38688bfe387716d9c7d3a",
          "expect": "match"
        }
      },
      "expected": true
    },
    {
      "id": "manifest.unavailable.missing-capability",
      "predicate": "manifest",
      "precondition": "envelope-valid",
      "document": {
        "source": "manifest",
        "patches": [
          {
            "op": "remove",
            "path": "/capabilities/1"
          },
          {
            "op": "replace",
            "path": "/operations/0/availability",
            "value": {
              "state": "unavailable",
              "problem": {
                "type": "urn:gauntlet:problem:unsupported-capability",
                "title": "Operation requirements are unavailable",
                "status": 501
              }
            }
          }
        ],
        "revision": {
          "mode": "set",
          "value": "sha256:b090620310525819f3950d5289775ac2d03b1ee3f815f892bdd0c914a31d5a47",
          "expect": "match"
        }
      },
      "expected": true
    },
    {
      "id": "manifest.unavailable.missing-mixed",
      "predicate": "manifest",
      "precondition": "envelope-valid",
      "document": {
        "source": "manifest",
        "patches": [
          {
            "op": "remove",
            "path": "/profiles/1"
          },
          {
            "op": "remove",
            "path": "/capabilities/0"
          },
          {
            "op": "replace",
            "path": "/operations/0/availability",
            "value": {
              "state": "unavailable",
              "problem": {
                "type": "urn:gauntlet:problem:unsupported-capability",
                "title": "Operation requirements are unavailable",
                "status": 501
              }
            }
          }
        ],
        "revision": {
          "mode": "set",
          "value": "sha256:5b90232addf85bb7734aa678d3e78e764982b4cd749bf0d187bc1f88c84909e8",
          "expect": "match"
        }
      },
      "expected": true
    },
    {
      "id": "manifest.available.missing-profile",
      "predicate": "manifest",
      "precondition": "envelope-valid",
      "document": {
        "source": "manifest",
        "patches": [
          {
            "op": "remove",
            "path": "/profiles/2"
          }
        ],
        "revision": {
          "mode": "set",
          "value": "sha256:4c029f4d0ca6ed83603ce82d1f310a615bfc01f668ed4220f7b639ec9d3a3a17",
          "expect": "match"
        }
      },
      "expected": false
    },
    {
      "id": "manifest.available.missing-capability",
      "predicate": "manifest",
      "precondition": "envelope-valid",
      "document": {
        "source": "manifest",
        "patches": [
          {
            "op": "remove",
            "path": "/capabilities/1"
          }
        ],
        "revision": {
          "mode": "set",
          "value": "sha256:5c289ffa6123cc648792f731b086e58d9c419ef28e0276eb6693d9b9561c0b22",
          "expect": "match"
        }
      },
      "expected": false
    },
    {
      "id": "manifest.available.missing-mixed",
      "predicate": "manifest",
      "precondition": "envelope-valid",
      "document": {
        "source": "manifest",
        "patches": [
          {